{
  "evidence_id": "EV-2026-07-12-0001",
  "device_id": "device-insecure",
  "test_id": "TEST-HTTP-HEADERS",
  "tool": "curl",
  "tool_version": "curl 8.14.1 (x86_64-pc-linux-gnu) libcurl/8.14.1 OpenSSL/3.5.6 zlib/1.3.1 brotli/1.1.0 zstd/1.5.7 libidn2/2.3.8 libpsl/0.21.2 libssh2/1.11.1 nghttp2/1.64.0 nghttp3/1.8.0 librtmp/2.3 OpenLDAP/2.6.10",
  "command": "curl -s -I http://device-insecure/",
  "timestamp": "2026-07-12T18:20:39+00:00",
  "finding": "This is a test findings results I write!",
  "observations": {
    "missing_security_headers": ["X-Frame-Options", "Content-Security-Policy"]
  },
  "raw_output_path": "document-store/raw/EV-2026-07-12-0001.txt",
  "confidence": "high",
  "sha256": "7421af31aecc115c92498182563413bdb941aed43c90ff7d528544d52945ed61"
}
